name,department,info,cause,symptom
윌슨병,소화기내과`신경과`의학유전학센터`간이식ㆍ간담도외과`소아내분비대사과`소아소화기영양과`의학유전학과,윌슨병(Wilson's disease 또는 Hepatolenticular degeneration)은 구리 대사의 이상으로 인해 주로 간과 뇌의 기저핵에 과다한 양의 구리가 축적되는 유전 질환입니다.,윌슨병은 상염색체 열성으로 유전됩니다. 부모 양쪽 모두가 보인자라면 자녀가 환자일 확률은 25%입니다. 우리나라에서는 일반인 가운데 90~100명 중 1명의 빈도로 윌슨병의 유전자를 가지고 있습니다. 윌슨병은 구리의 흡수에 관여하는 효소인 copper transporting P-type ATPase(ATP7B) 유전자의 돌연변이에 의해 발생합니다. 이 유전자는 13번 염색체 장완 q14`3에 위치합니다. 이 유전자의 이상으로 구리가 간장 세포 내에서 미세 담도로 배출되지 못합니다. 또한 구리가 세룰로플라스민과 결합하지 못하여 혈액 내로 배출되지 못함으로써 간장 세포` 적혈구` 뇌 등의 장기에 구리가 침착되고 중독 증상이 나타납니다. 유전자 발견 이후` 윌슨 유전자에 대한 돌연변이 연구가 집중적으로 이루어졌습니다. 그 결과 유전자의 돌연변이 양상에 동서양 간 차이가 있음이 확인되었습니다. 전체적으로 윌슨병 환자의 80% 정도에서 ATP7B 유전자의 돌연변이를 발견할 수 있습니다. 한국인의 경우 R778L이 30% 정도를 차지하여` 가장 흔한 돌연변이임이 최근에 밝혀졌습니다. 이 밖에 A874V과 N1270S도 각각 15% 정도를 차지하여 비교적 흔한 돌연변이에 해당합니다.,윌슨병의 주 증상은 간 질환과 신경 질환입니다. 정신과적인 문제를 보이기도 합니다. 15세 이전에는 주로 간 질환이 나타나고` 15세 이후에는 신경 증상을 보입니다. 약 40~50%의 환자가 간 장애를` 35~50%의 환자가 신경 증상이나 정신과적인 증상을 보입니다. 신경 증상을 보이는 거의 모든 환자에게 각막환(Kayser-Fleischer ring)이 나타납니다. 다양한 형태로 발생하며 원인을 설명하기 힘든 신경학적 이상` 정신과적 이상` 간염` 용혈성 빈혈` 뼈 이상` 혈뇨 등이 나타날 수 있습니다. 이 밖에도 가족 검사나 일반 건강 검진으로 간 기능 이상이 발견되는 경우도 있습니다. 1` 간 이상소아에게는 주로 간 질환이 나타납니다. 간에 구리가 축적되어 증상이 나타나므로 보통 5세가 지나야 발병합니다. 간에 구리가 침착되면 처음에는 간 효소치만 약간 증가하고 증상이 없는 간장 비대만 나타납니다. 결국은 만성 활동성 간염` 간경화` 문맥압 항진증으로 진행합니다. 간혹 급성 전격성 간염이 발생하여` 급격히 간성 혼수로 빠지면서 사망에 이를 수도 있습니다. 2` 신경계 이상윌슨병의 신경계 증상은 대뇌 기저핵 손상으로 인하여 발생합니다. 사춘기 이전에 증상이 나타나는 경우는 드물고` 대부분 15세 이후 청소년기에 나타납니다. 대뇌 기저핵이 손상되어 구음 장애` 연하 장애` 무표정한 얼굴` 비정상적인 눈의 움직임` 미세 운동 장애` 근 긴장 이상` 근 긴장 이상 자세` 운동 장애(불안정한 보행` 무도증` 근위부 진전 등)가 나타납니다. 3` 정신과적 이상구리가 뇌에 중독되어 정신과적 이상이 나타납니다. 과잉 행동` 불안 또는 공포` 정서 불안` 감정 조절의 어려움` 조울증` 비정상적인 행동` 집중력 저하` 인성 변화` 정신분열증의 증상이 나타납니다. 이 중에서 가장 흔한 증상은 비정상적인 행동입니다. 구리를 제거하는 약물 치료로 정신 증상이 호전되기는 하지만` 추가적인 치료가 필요합니다. 4` 안과적 이상각막의 테두리를 따라서 황록색의 특이한 각막환(Kayser-Fleischer ring)이 나타납니다. 육안으로는 잘 볼 수 없고` 세극등 현미경(slit lamp) 검사로 확인할 수 있습니다. 간 질환만 있는 경우에는 안과적 이상이 없을 수도 있습니다. 그러나 신경 증상이 있는 대부분의 환자에게서 안과적 이상이 관찰됩니다. 해바라기 모양의 백내장` 외사시` 야맹증 등이 올 수도 있습니다.   5` 혈액 이상때로는 과량의 구리가 용혈성 빈혈을 유발합니다. 6` 신장 이상주로 근위세뇨관의 손상으로 나타납니다. 혈뇨` 아미노산뇨증` 요비중의 감소` 당뇨` 요산뇨증(uricosuria)` 과인산뇨증(hyperphosphaturia)` 신세뇨관성산증(renal tubular acidosis) 등의 판코니(Fanconi) 증후군이 나타날 수 있습니다. 그 결과 뼈가 아프고` 성장기의 소아가 잘 자라지 않고` 등이 굽을 수 있습니다. 7` 골격 이상과인산뇨증 때문에 혈중 인산의 농도가 낮아집니다. 그 결과 골다공증` 구루병` 뼈의 골절 등이 나타날 수 있습니다. 8` 관절통관절통이 올 수 있습니다. 대개 무릎 관절의 통증을 호소하는 경우가 많습니다. 9` 내분비 이상여성의 경우 난소 기능 장애로 이차성 무월경 등이 발생하기도 합니다. 
유당불내증,가정의학과,유당은 우유에 함유된 물질입니다. 유당 분해 효소인 락타아제가 부족한 사람이 유당을 섭취하면` 유당이 소장에서 삼투 현상에 의해 수분을 끌어들임으로써 팽만감과 경련을 일으키고` 대장을 통과하면서 설사를 유발합니다. 이러한 현상을 유당분해효소결핍증이라 합니다.,유당분해효소결핍증의 원인은 크게 3가지로 분류됩니다. ① 일차성 유당분해효소 결핍광범위하게 나타납니다. 인종에 따라 발생률이 다릅니다. 유제품(우유` 치즈` 아이스크림` 요거트 등) 섭취 정도와 유당을 소화할 수 있는 개인의 능력과 관계가 깊습니다. 동양인은 어려서부터 락타아제의 결핍이 나타나 백인과 비교하였을 때 유당분해효소결핍증이 있는 경우가 많습니다.  ② 이차성 유당분해효소 결핍유당분해효소를 분비하는 소장 세포가 장내 감염(로타바이러스 등) 등에 의해 손상을 받아 염증이 발생하면` 염증이 자연 치유되면서 락타아제 세포가 함께 소실되어 재생되지 않을 수 있습니다. 락타아제가 소실된 상태에서 우유를 섭취하면 유당이 제대로 소화되지 못하여 대장으로 직접 이동하여 유당분해효소결핍증이 나타납니다. ③ 선천성 유당분해효소 결핍상염색체 열성 유전 질환으로` 드물게 나타납니다. 신생아가 모유나 우유를 섭취한 후 난치성 설사 현상을 나타냅니다.,우유를 마신 후 속이 불편하거나 더부룩한 느낌` 설사와 복통` 복부 팽만` 오심 등의 증상이 나타날 수 있습니다. 증상을 일으키는 유당량은 개인마다 다릅니다. 유당 섭취량` 락타아제의 결핍 정도` 섭취 유당 함유 식품의 형태에 따라 좌우됩니다.
유방낭종,유방외과`피부과,낭종이란 주위 조직과 뚜렷이 구별되는 막과 내용물을 지닌 주머니를 말합니다. 낭종은 신장` 간` 유방` 피부 등 어느 부위에나 생길 수 있습니다. 통상적으로 낭종이 한번 형성되면 수술로 제거되지 않는 한 없어지지 않고 평생 지속됩니다. 낭종의 대부분은 양성이어서 건강에 큰 영향을 미치지 않지만 간혹 암이나 전암성 병변(암이 되기 전 단계의 병변)일 수 있으며` 심각한 기저질환을 의미할 수도 있습니다.,유방낭종은 여성호르몬의 농도에 영향을 받습니다. 낭종은 피부 바로 밑에서 느껴지기도 하고 유방 심부(깊은 곳)에 발생하기도 합니다. 대개 통증은 없으며 단독보다는 다발성으로 잘 생기고 양측성으로도 생기며` 몇 가지의 임상적 단계를 거치거나 한 가지 형태로만 나타날 때도 있습니다. 원인은 확실하지 않지만 월경주기의 에스트로겐 수준과 관련이 있는 것으로 보이며` 폐경 후 에스트로겐이 분비되지 않으면 증상이 완화됩니다.,대개 둔하거나 쑤시는 통증이 결절 부위에 있으며 생리 직전에 통증이 심합니다. 어떤 경우에는 통증은 없고 덩어리나 유두 분비물만을 호소하는 경우도 있습니다.
유방농양,유방외과,유방에 여러 가지 원인으로 염증이 생긴 것을 유선염이라고 하고` 유선염이 진행되어 유방에 고름 주머니가 생긴 것을 유방 농양이라고 합니다.,유방 농양은 20~40세의 여성에게 주로 발생합니다. 원인균은 포도상구균과 연쇄상구균입니다. 감염균은 대부분 수유 중에 아기의 입을 통하여 엄마 유방의 손상된 피부 부위를 통해 침입합니다. 세균은 젖이 고여 있는 곳에서 아주 잘 자라며` 염증과 고름을 만듭니다. 유선염 환자의 5~11%가 유방 농양으로 진행합니다. 유방 농양은 주로 유두가 함몰된 경우에 잘 발생합니다. 이때는 항상 깨끗이 하도록 합니다. 감염균은 피부의 손상 없이 유관을 통해 침입하기도 합니다. 당뇨병 등의 만성 질환이 있으면 감염에 대한 면역력이 감소하여 수유에 관계없이 유방 조직에 감염 및 염증을 일으킬 수 있습니다. 유방이 손상을 받은 경우` 즉 부딪혀 으깨지거나 날카로운 물건에 찔린 경우에도 생길 수 있습니다.,염증에 의해 유방의 통증` 부종` 발적` 국소적 또는 전신적인 발열` 가려움증` 유두로 분비되는 농양` 겨드랑이 부위의 림프절이 커지는 등의 증상이 나타날 수 있습니다. 염증이 심해지면 조직이 녹고 고름집이 만들어집니다. 이로 인해 아프고 물렁물렁한 멍울이 생깁니다. 유방 전체가 단단해지고` 감염 부위 유방의 피부 변화(발적)와 심한 통증을 보입니다. 만성으로 진행되기도 하며` 커다란 농양을 형성하기도 합니다. 
유방염,유방외과,유선염은 유방에 생기는 세균성 감염을 말합니다.,유선염은 병균이 유두의 상처로 침범한 뒤 고인 젖에서 자라서 발생합니다. 유선염은 젖꼭지가 갈라졌거나 젖 구멍이 막힌 경우에 더 잘 발생합니다. 너무 꽉 끼이는 브래지어를 사용하면 유방을 압박해서 유관이 막히고` 이렇게 막힌 유관에 젖이 고이면 유선염이 생길 수 있습니다. 그 밖에 아기에게 젖을 자주 주지 않은 경우` 빈혈` 스트레스` 피로 등으로 엄마의 면역이 떨어진 경우에 잘 생깁니다.,유선염에 걸리면 유방이 아프면서 38`5℃ 이상의 고열이 생깁니다. 한기가 들기도 하며` 온몸이 쑤시고 감기에 걸린 것처럼 아프기도 합니다. 유선염이 생긴 부위는 쐐기 모양으로 붉게 변하고` 열감이 느껴지며` 붓고 아프고` 콕콕 찌르는 느낌이 들기도 합니다. 유방 내부에 멍울이 생겨 아픕니다. 겨드랑이 하부의 림프절이 붓기도 합니다. 대개 한쪽의 유방에만 생깁니다.
임신,산부인과,임신이란 수정란이 자궁 내벽에 착상하여 모체로부터 영양을 공급받으며 태아로 발육하는 과정이다. 사람의 임신기간은 일반적으로 약 280일이다.,,
자궁근종,산부인과,자궁의 평활근종은 자궁의 근육세포에서 생기는 종양입니다. 자궁에서 가장 흔히 발생하는 양성 종양입니다. 흔히 자궁근종이라고 부릅니다. 에스트로겐의 영향을 받는 일종의 호르몬 의존성 종양입니다. 여성에게 비교적 흔한 질병으로` 가임기 여성의 약 25~35%에서 발견됩니다. 특히 35세 이상의 여성 40~50%에게 발견됩니다.,자궁 평활근종의 원인은 아직까지 정확하게 밝혀지지 않았습니다. 다만` 자궁의 평활근을 이루는 세포 중 비정상적인 세포가 증식하여 자궁근종을 형성하는 것으로 추정됩니다. 가족력도 어느 정도 있습니다.,자궁 평활근종이 있는 여성이더라도 50% 이상은 특별한 증상이 나타나지 않습니다. 증상이 있는 경우에는 자궁근종의 위치` 수` 크기 등에 따라 다양한 증상이 유발될 수 있습니다. 월경 과다가 가장 흔한 증상입니다. 이 밖에도 비정상 자궁 출혈` 월경 불순` 골반 통증` 월경통` 골반 압박감` 빈뇨` 성교통` 복통` 요통` 불임 및 생식기능 이상 등의 증상이 나타날 수 있습니다.
자궁외임신,산부인과,자궁 외 임신은 수정란이 정상적으로 착상을 하는 장소인 자궁 내부가 아니라 다른 장소에 착상되는 임신을 말합니다.,자궁 외 임신에서 수정란이 흔히 착상하는 부위로는 난관` 자궁 경관` 난소` 복강 등이 있습니다. 그중에서 95%는 난관 임신에 해당합니다. 자궁 외 임신은 다양한 원인에 의해 발생할 수 있습니다. 골반 감염에 의한 염증` 수술 등에 의한 난관 손상` 피임을 위해 자궁 내 피임 장치를 삽입한 경우` 불임 수술` 과거의 개복 수술 경험` 유산` 불임` 난관의 비염증성 질환` 자궁내막증` 자궁근종` 약물` 흡연 등이 관련되어 있습니다.,자궁 외 임신의 초기 증상은 둔한 하복부 통증과 소량의 출혈입니다. 일반적인 유산의 초기 증세와 비슷하다고 생각하거나` 생리가 늦어진다고 생각하여 그냥 지나치는 경우가 많습니다. 하지만 착상된 수정란이 점차 커지면서 난관 파열` 혈복강` 질 출혈이 일어날 수 있습니다. 난관 파열이나 난관 유산되면 갑자기 하복부에 심한 통증과 함께 질 출혈이 발생합니다. 얼굴이 창백해지고` 맥이 빨라지고` 식은땀이 나고` 호흡이 곤란해집니다. 병이 진행되면 복강 안에 대량의 출혈이 일어나 쇼크 상태에 빠지기도 합니다. 출혈이 심한 경우에는 응급 수술 등의 응급 치료가 필요합니다.
장폐색,소화기내과`소아외과`대장항문외과,장폐색은 소장이나 대장의 일부가 여러 요인에 의해 부분적으로 또는 완전히 막혀서 장의 내용물(음식물` 소화액` 가스)이 빠져나가지 못하여` 배변과 가스가 장내에 축적되어 장애를 일으키는 현상을 말합니다.,장폐색의 원인은 크게 장관이 기계적으로 막힌 경우와 장관의 운동이 마비된 경우로 나눌 수 있습니다. ① 장관이 기계적으로 막힌 경우장의 통과 장애가 일어나서 장관이 기계적으로 막힙니다. 개복 수술 후에 장의 유착이 생긴 경우` 대장암 등으로 장관이 막힌 경우` 탈장이 심하고 오래되어 장관이 막힌 경우` 장중첩이 일어난 경우` 장관의 일부가 꼬여 매듭을 이루는 경우에 발생할 수 있습니다. ② 장관의 운동이 마비된 경우장 이외의 장소에서 일어난 장애의 영향을 받아 장 기능이 저하되어 발생합니다. 위 또는 십이지장 궤양의 천공 등으로 급성 복막염이 생긴 경우` 급성 췌장염` 급성 담낭염` 복부 외상 등으로 복막에 심한 자극이 생긴 경우` 복부 수술을 시행한 직후 과량의 장기능 억제제를 사용한 경우에 발생할 수 있습니다.,장폐색의 대표적인 증상으로는 복통` 구토가 있습니다. ① 복통복통은 발작성 혹은 경련성 통증으로 나타납니다. 좁아진 부위로 음식물을 밀어내기 위해서 장운동이 늘어나면서 통증이 생깁니다. 처음에는 폐색을 일으킨 부분에만 통증이 나타나다가` 점차 배 전체로 퍼지게 됩니다. ② 구토장이 폐색된 병변의 위쪽 부분은 음식이나 체액` 소화액` 가스 등이 차면서 급격히 팽창하여 복부 팽만과 오심` 구토를 초래합니다. 구토의 정도는 폐색이 일어난 부위에 따라 다릅니다. 상부 소장이 막히면 처음부터 심한 구토증이 나타납니다. 처음에는 황갈색의 담즙이 섞인 액체를 토하다가` 시간이 지나면 대변 냄새가 나는 물질을 토합니다. 또한 수분 결핍이 심하며` 전신 증상도 단시간 내에 악화됩니다. ③ 기타장이 완전히 폐색되면 대변을 보고 싶지만 전혀 볼 수 없습니다. 장폐색이 일어난 부분의 아래쪽 변은 배설될 수도 있습니다. 장폐색의 원인이 장중첩증일 때는 혈변이 나오기도 합니다. 소화 흡수 장애에 의한 수분과 전해질의 불균형에 의해 탈수` 빈맥` 저혈압이 나타납니다.
전립선염 / 전립선암,비뇨의학과,전립선에 염증이 생기는 병으로` 성인 남성에서는 50%가 평생동안 한번은 전립선염 증상을 경험한다고 할 정도로 흔한 질환입니다./전립선에 암세포가 발생한 것입니다.,만성 전립선염이 생기는 가장 흔한 원인으로는 요로계 감염 시 세균이 요도를 통해 직접 감염이 되는 경우입니다. 그러나 전립선액의 배설장애` 전립선 내로의 요 역류가 원인이 되기도 하며 치질이나 대장염과 같은 염증이 림프관을 통해 전염될 수도 있습니다. 대표적인 원인균으로는 장내 세균` 장구균` 임질균` 유레아플라즈마` 클라미디아 등이 있으며 바이러스` 원충류의 감염과 자가면역` 정신적 요인(스트레스` 피로` 우울증) 또한 원인이 될 수 있습니다. 전립선액 내의 항균인자인 아연의 농도 저하` 전립선 석회화나 결석도 재발의 원인으로 작용할 수 있습니다.,가장 흔히 호소하는 증상은 회음부의 불쾌감으로 가벼운 불쾌감에서 심한 작열감 및 압박감` 통증까지 다양하게 나타납니다.전신무력감` 피로` 빈뇨` 배뇨곤란` 긴박뇨` 잔뇨감` 야간뇨` 요도구 끝의 통증이나 불쾌감` 사정 시의 통증이나 이상 분비물` 발기부전이나 조루 등이 나타날 수 있습니다. 또 소변이 탁하고 간혹 우윳빛이나 혈성 분비물이 보이기도 합니다. 과음` 과로` 스트레스` 과격한 성생활` 장거리 운전` 장시간 앉아서 일을 한 후에는 증상이 악화될 수 있습니다. 기타 증상으로는 팔다리저림` 허리 통증 등의 이상을 보이기도 합니다.
전염성 단핵구증,감염내과`혈액내과,감염성 단핵구증은 주로 엡스타인-바 바이러스(EBV)에 의해 발생하는 일련의 증상(발열` 편도선염` 림프절 비대)을 일컫는 진단명입니다.,감염성 단핵구증의 가장 주된 원인은 엡스타인-바 바이러스(EBV)이며` 바이러스가 림프구를 감염시킴으로써 여러 가지 증상이 나타납니다. 이 감염은 매우 흔하게 나타납니다. 또한 감염된 사람 중 절반 이상은 특별한 증상이 발견되지 않기 때문에 감염 여부를 모르고 지나가는 경우가 있습니다. 전파의 주된 경로는 타액입니다. 기침이나 재채기에 의해 감염된 타액의 비말과 점액이 공중에 떠다니다가 다른 사람에게 호흡되어 전파되거나` 같은 그릇에 음식을 나누어 먹거나 마시면서 감염되기도 합니다.,감염된 후 4~8주 정도의 잠복기가 지난 후에 증상이 나타납니다. 첫 증상은 무기력함이나 쇠약감` 식욕 상실` 고열` 오한입니다. 그 이후에 점차 심한 증상이 나타나는데` 가장 흔한 증상으로 인후통` 발열` 이하선 부종이 있습니다. 편도가 심하게 붓거나 점액이 낄 수 있고` 인후통으로 인해 음식물을 삼키기 힘들며 목` 겨드랑이` 사타구니의 림프절의 통증과 부종이 있습니다. 또한 비장이 커져서 복부에 압통을 느낄 수 있으며` 식욕 감퇴` 체중 감소` 두통` 피로감이 생깁니다. 드물게 얼굴과 몸에 발진이 나타나기도 합니다. 인후통과 고열 증상은 금방 없어지며 다른 증상도 일주일 정도 지나면 호전됩니다. 그러나 통증이 오래 남아 있을 수 있고` 감염 후 수개월 동안 무기력증을 호소하기도 합니다.
질염,산부인과,질염은 여성의 생식기인 질이 세균에 감염되어 염증이 생긴 것을 의미합니다. 정상적인 질에서는 항상 윤활액을 분비하여 질벽을 보호합니다. 이러한 분비물은 냄새가 없고 맑아야 정상입니다. 그러나 질에 염증이 생기면 질 분비물의 냄새가 심하거나` 외음부의 가려움증이 생기거나` 색깔이 평소와 다르게 변합니다.,질염은 원인에 따라 세균성 질염` 트리코모나스 질염` 칸디다 질염 등으로 나눌 수 있습니다. 정확한 기전은 알려지지 않았습니다. 다만 성교나 질 세척 후 질 내의 산도(pH4.5)가 변화되어 질염을 유발한다고 알려져 있습니다. 그 외에도 꽉 조이는 의류나 통기가 안 되는 옷의 착용` 경구용 피임제 복용` 폐경` 당뇨병 등 질 내의 산도를 변화시킬 수 있는 요인에 의해서 질염이 생길 수 있습니다.,질염의 가장 흔한 증상은 분비물 증가입니다. 심하면 속옷이 젖을 정도로 분비물이 많이 나오기도 합니다. 질 분비물에서 비린내 같은 악취가 나는 경우도 있습니다. 질 입구의 가려움` 화끈거림` 성관계 시 통증` 배뇨 시 쓰라림 등을 동반합니다.
